[
	{
		"id": "proxima",
		"tier": "core",
		"wealth": 1.2,
		"produce": {
			"consumer_goods": 13.5,
			"data": 13.0,
			"pharmaceuticals": 11.0,
			"food_products": 1.0,
			"energy": 1.0,
			"industrial_components": 1.0,
			"chemicals": 1.0,
			"advanced_raw_materials": 1.0,
			"luxury_goods": 1.0,
			"military_goods": 1.0,
			"compute_cores": 1.0,
			"minerals": 1.0,
			"water_ice": 1.0
		},
		"consume": {
			"food_products": 14.5,
			"advanced_raw_materials": 13.5,
			"industrial_components": 11.5,
			"chemicals": 11.0,
			"energy": 14.0,
			"minerals": 12.5,
			"water_ice": 12.5
		}
	},
	{
		"id": "irasia",
		"tier": "core",
		"wealth": 1.1,
		"produce": {
			"industrial_components": 14.5,
			"chemicals": 13.5,
			"consumer_goods": 12.0,
			"compute_cores": 11.0,
			"energy": 13.5,
			"food_products": 1.0,
			"pharmaceuticals": 1.0,
			"data": 1.0,
			"advanced_raw_materials": 1.0,
			"luxury_goods": 1.0,
			"military_goods": 1.0,
			"minerals": 1.0,
			"water_ice": 1.0
		},
		"consume": {
			"food_products": 11.5,
			"luxury_goods": 12.0,
			"minerals": 14.0
		}
	},
	{
		"id": "tokirev",
		"tier": "core",
		"wealth": 1.0,
		"produce": {
			"industrial_components": 15.0,
			"chemicals": 14.5,
			"compute_cores": 13.5,
			"advanced_raw_materials": 13.5,
			"military_goods": 11.0,
			"energy": 15.0,
			"food_products": 1.0,
			"pharmaceuticals": 1.0,
			"consumer_goods": 1.0,
			"data": 1.0,
			"luxury_goods": 1.0,
			"minerals": 1.0,
			"water_ice": 1.0
		},
		"consume": {
			"food_products": 13.0,
			"consumer_goods": 11.0,
			"luxury_goods": 10.5,
			"minerals": 15.0,
			"water_ice": 14.0
		}
	},
	{
		"id": "new_carthage",
		"tier": "core",
		"wealth": 1.15,
		"produce": {
			"luxury_goods": 8.1,
			"data": 8.1,
			"consumer_goods": 7.5,
			"food_products": 1.0,
			"pharmaceuticals": 1.0,
			"energy": 1.0,
			"industrial_components": 1.0,
			"chemicals": 1.0,
			"advanced_raw_materials": 1.0,
			"military_goods": 1.0,
			"compute_cores": 1.0,
			"minerals": 1.0,
			"water_ice": 1.0
		},
		"consume": {
			"industrial_components": 7.5,
			"chemicals": 7.2,
			"food_products": 6.6,
			"energy": 6.6,
			"minerals": 6.9
		}
	},
	{
		"id": "fortuna",
		"tier": "mid",
		"wealth": 1.25,
		"produce": {
			"luxury_goods": 8.7,
			"data": 8.1,
			"consumer_goods": 6.9,
			"food_products": 1.0,
			"pharmaceuticals": 1.0,
			"energy": 1.0,
			"industrial_components": 1.0,
			"chemicals": 1.0,
			"advanced_raw_materials": 1.0,
			"military_goods": 1.0,
			"compute_cores": 1.0,
			"minerals": 1.0,
			"water_ice": 1.0
		},
		"consume": {
			"industrial_components": 7.5,
			"military_goods": 6.9,
			"advanced_raw_materials": 6.6,
			"energy": 7.2,
			"minerals": 6.6
		}
	},
	{
		"id": "horizon",
		"tier": "mid",
		"wealth": 1.05,
		"produce": {
			"consumer_goods": 8.1,
			"food_products": 7.5,
			"pharmaceuticals": 7.5,
			"data": 1.0,
			"energy": 1.0,
			"industrial_components": 1.0,
			"chemicals": 1.0,
			"advanced_raw_materials": 1.0,
			"luxury_goods": 1.0,
			"military_goods": 1.0,
			"compute_cores": 1.0,
			"minerals": 1.0,
			"water_ice": 1.0
		},
		"consume": {
			"advanced_raw_materials": 7.5,
			"compute_cores": 7.5,
			"industrial_components": 6.6,
			"energy": 6.9,
			"minerals": 6.6
		}
	},
	{
		"id": "bela",
		"tier": "mid",
		"wealth": 1.2,
		"produce": {
			"luxury_goods": 6.2,
			"consumer_goods": 4.4,
			"food_products": 1.0,
			"pharmaceuticals": 1.0,
			"data": 1.0,
			"energy": 1.0,
			"industrial_components": 1.0,
			"chemicals": 1.0,
			"advanced_raw_materials": 1.0,
			"military_goods": 1.0,
			"compute_cores": 1.0,
			"minerals": 1.0,
			"water_ice": 1.0
		},
		"consume": {
			"food_products": 5.4,
			"industrial_components": 5.0,
			"chemicals": 4.6,
			"pharmaceuticals": 4.2,
			"energy": 5.4
		}
	},
	{
		"id": "pelagos",
		"tier": "mid",
		"wealth": 1.0,
		"produce": {
			"advanced_raw_materials": 5.4,
			"chemicals": 5.4,
			"industrial_components": 5.0,
			"military_goods": 4.2,
			"energy": 5.2,
			"minerals": 5.4,
			"food_products": 1.0,
			"pharmaceuticals": 1.0,
			"consumer_goods": 1.0,
			"data": 1.0,
			"luxury_goods": 1.0,
			"compute_cores": 1.0,
			"water_ice": 1.0
		},
		"consume": {
			"luxury_goods": 5.0,
			"consumer_goods": 4.4
		}
	},
	{
		"id": "tycho",
		"tier": "outer",
		"wealth": 0.85,
		"produce": {
			"advanced_raw_materials": 5.8,
			"chemicals": 5.4,
			"military_goods": 5.0,
			"industrial_components": 4.6,
			"energy": 5.0,
			"minerals": 5.8,
			"food_products": 1.0,
			"pharmaceuticals": 1.0,
			"consumer_goods": 1.0,
			"data": 1.0,
			"luxury_goods": 1.0,
			"compute_cores": 1.0,
			"water_ice": 1.0
		},
		"consume": {
			"food_products": 7.0,
			"consumer_goods": 5.0,
			"pharmaceuticals": 5.0,
			"water_ice": 7.2
		}
	},
	{
		"id": "fennet",
		"tier": "outer",
		"wealth": 0.9,
		"produce": {
			"food_products": 6.6,
			"chemicals": 5.0,
			"consumer_goods": 4.2,
			"water_ice": 5.0,
			"pharmaceuticals": 1.0,
			"data": 1.0,
			"energy": 1.0,
			"industrial_components": 1.0,
			"advanced_raw_materials": 1.0,
			"luxury_goods": 1.0,
			"military_goods": 1.0,
			"compute_cores": 1.0,
			"minerals": 1.0
		},
		"consume": {
			"industrial_components": 5.0,
			"compute_cores": 5.0,
			"luxury_goods": 4.6,
			"advanced_raw_materials": 4.4,
			"energy": 4.8
		}
	},
	{
		"id": "titania",
		"tier": "outer",
		"wealth": 1.1,
		"produce": {
			"luxury_goods": 5.4,
			"consumer_goods": 4.2,
			"food_products": 1.0,
			"pharmaceuticals": 1.0,
			"data": 1.0,
			"energy": 1.0,
			"industrial_components": 1.0,
			"chemicals": 1.0,
			"advanced_raw_materials": 1.0,
			"military_goods": 1.0,
			"compute_cores": 1.0,
			"minerals": 1.0,
			"water_ice": 1.0
		},
		"consume": {
			"food_products": 5.4,
			"industrial_components": 5.0,
			"military_goods": 4.6,
			"pharmaceuticals": 4.2,
			"energy": 5.2
		}
	},
	{
		"id": "centauri_a_beltworks",
		"tier": "outer",
		"wealth": 0.85,
		"produce": {
			"advanced_raw_materials": 11.0,
			"energy": 2.9,
			"industrial_components": 2.2,
			"minerals": 11.0,
			"water_ice": 9.0
		},
		"consume": {
			"food_products": 12.0,
			"industrial_components": 2.4,
			"pharmaceuticals": 2.1,
			"water_ice": 3.0
		}
	},
	{
		"id": "acb1",
		"tier": "outer",
		"wealth": 0.85,
		"produce": {
			"advanced_raw_materials": 11.0,
			"energy": 2.9,
			"industrial_components": 2.2,
			"minerals": 11.0,
			"water_ice": 9.0
		},
		"consume": {
			"food_products": 12.0,
			"industrial_components": 2.4,
			"pharmaceuticals": 2.1,
			"water_ice": 3.0
		}
	},
	{
		"id": "acb2",
		"tier": "outer",
		"wealth": 0.85,
		"produce": {
			"advanced_raw_materials": 11.0,
			"energy": 2.9,
			"industrial_components": 2.2,
			"minerals": 11.0,
			"water_ice": 9.0
		},
		"consume": {
			"food_products": 12.0,
			"industrial_components": 2.4,
			"pharmaceuticals": 2.1,
			"water_ice": 3.0
		}
	},
	{
		"id": "acb3",
		"tier": "outer",
		"wealth": 0.8,
		"produce": {
			"chemicals": 4.4,
			"advanced_raw_materials": 5.0,
			"energy": 2.4,
			"minerals": 6.0,
			"water_ice": 5.0
		},
		"consume": {
			"food_products": 9.0,
			"industrial_components": 2.3,
			"pharmaceuticals": 2.0,
			"water_ice": 3.0
		}
	},
	{
		"id": "terminus",
		"tier": "outer",
		"wealth": 0.8,
		"produce": {
			"chemicals": 4.4,
			"advanced_raw_materials": 5.0,
			"energy": 2.4,
			"minerals": 6.0,
			"water_ice": 5.0
		},
		"consume": {
			"food_products": 9.0,
			"industrial_components": 2.3,
			"pharmaceuticals": 2.0,
			"water_ice": 3.0
		}
	},
	{
		"id": "vulcan_research",
		"tier": "outer",
		"wealth": 0.95,
		"produce": {
			"data": 3.6,
			"energy": 2.2
		},
		"consume": {
			"energy": 7.0,
			"industrial_components": 4.4,
			"pharmaceuticals": 2.8,
			"food_products": 4.0,
			"minerals": 2.4,
			"water_ice": 5.0
		}
	},
	{
		"id": "regulus_belt",
		"tier": "outer",
		"wealth": 0.85,
		"produce": {
			"advanced_raw_materials": 11.0,
			"energy": 2.9,
			"industrial_components": 2.2,
			"minerals": 11.0,
			"water_ice": 9.0
		},
		"consume": {
			"food_products": 12.0,
			"industrial_components": 2.4,
			"pharmaceuticals": 2.1,
			"water_ice": 3.0
		}
	},
	{
		"id": "denarius_ii",
		"tier": "outer",
		"wealth": 0.85,
		"produce": {
			"advanced_raw_materials": 11.0,
			"energy": 2.9,
			"industrial_components": 2.2,
			"minerals": 11.0,
			"water_ice": 9.0
		},
		"consume": {
			"food_products": 12.0,
			"industrial_components": 2.4,
			"pharmaceuticals": 2.1,
			"water_ice": 3.0
		}
	},
	{
		"id": "typhon_xvi",
		"tier": "outer",
		"wealth": 0.85,
		"produce": {
			"advanced_raw_materials": 11.0,
			"energy": 2.9,
			"industrial_components": 2.2,
			"minerals": 11.0,
			"water_ice": 9.0
		},
		"consume": {
			"food_products": 12.0,
			"industrial_components": 2.4,
			"pharmaceuticals": 2.1,
			"water_ice": 3.0
		}
	},
	{
		"id": "pelagos_belt",
		"tier": "outer",
		"wealth": 0.85,
		"produce": {
			"advanced_raw_materials": 11.0,
			"energy": 2.9,
			"industrial_components": 2.2,
			"minerals": 11.0,
			"water_ice": 9.0
		},
		"consume": {
			"food_products": 12.0,
			"industrial_components": 2.4,
			"pharmaceuticals": 2.1,
			"water_ice": 3.0
		}
	},
	{
		"id": "aurelia",
		"tier": "outer",
		"wealth": 0.85,
		"produce": {
			"advanced_raw_materials": 6.0,
			"data": 2.0,
			"minerals": 8.0
		},
		"consume": {
			"consumer_goods": 3.0,
			"food_products": 8.0,
			"luxury_goods": 4.0,
			"water_ice": 6.0
		}
	},
	{
		"id": "boreas",
		"tier": "outer",
		"wealth": 0.85,
		"produce": {
			"advanced_raw_materials": 8.0,
			"energy": 2.5,
			"minerals": 11.0,
			"water_ice": 9.0
		},
		"consume": {
			"food_products": 10.0,
			"industrial_components": 3.0,
			"pharmaceuticals": 2.5
		}
	},
	{
		"id": "calypso_vi",
		"tier": "outer",
		"wealth": 0.9,
		"produce": {
			"consumer_goods": 2.0,
			"luxury_goods": 4.0
		},
		"consume": {
			"energy": 3.0,
			"food_products": 8.0,
			"luxury_goods": 5.0,
			"pharmaceuticals": 2.0
		}
	},
	{
		"id": "hesper",
		"tier": "outer",
		"wealth": 0.8,